{
  "app": {
    "minimumVersion": "0.0.0",
    "savedByVersion": "0.0.0"
  },
  "createdAt": "2026-01-01T00:00:00Z",
  "features": [],
  "format": "mirae-project",
  "integrity": {
    "algorithm": "sha256",
    "contentHash": "94c0b3efbab0c0775ac6053b0ec84214aeda67b153de0d9cb8cca79e86c34bf0"
  },
  "lastSavedAt": "2026-01-02T03:04:05Z",
  "project": {
    "sceneItems": [],
    "scenes": [],
    "sources": [
      {
        "id": "08000000-0000-4000-8000-000000000000",
        "kind": "color",
        "name": "設設設設設設設設設設設設設設設設設設設設設設設設設設設設設設設設設設設設設設設設設設設設設設設設設設設設設設設設設設設設設設設設設設設設設設設設設設設設設設設設設設設設設設設設設設設設設設設設設設設設設設設設設設設設設設設設設設設設設設設設設設設設設設設設設設設設設設設設設設設設設設設設設設設設設設設設設設設設設設設設設設設設設設設設設設設設設設設設設設設設設設設設設設設設設設設設設設設設設設設設設設設設設設設設設設設設設設設設設設設設設設設設設設設設設設設設設設設設設設設設設設設設設設設設設設設設設設設設"
      }
    ]
  },
  "projectId": "07000000-0000-4000-8000-000000000000",
  "schemaVersion": 1
}
