{
  "app": {
    "minimumVersion": "0.0.0",
    "savedByVersion": "0.0.0"
  },
  "createdAt": "2026-01-01T00:00:00Z",
  "features": [],
  "format": "mirae-project",
  "integrity": {
    "algorithm": "sha256",
    "contentHash": "91c8015f72e90b5a61280bb055aeddb6c21fd627478e2267339e50bcecc7b8b7"
  },
  "lastSavedAt": "2026-01-02T03:04:05Z",
  "project": {
    "sceneItems": [
      {
        "id": "04000000-0000-4000-8000-000000000000",
        "sceneId": "03000000-0000-4000-8000-000000000000",
        "sourceId": "02000000-0000-4000-8000-000000000000",
        "visible": true
      },
      {
        "id": "05000000-0000-4000-8000-000000000000",
        "sceneId": "03000000-0000-4000-8000-000000000000",
        "sourceId": "02000000-0000-4000-8000-000000000000",
        "visible": false
      }
    ],
    "scenes": [
      {
        "id": "03000000-0000-4000-8000-000000000000",
        "items": [
          "05000000-0000-4000-8000-000000000000",
          "04000000-0000-4000-8000-000000000000"
        ],
        "name": "Main"
      }
    ],
    "sources": [
      {
        "id": "02000000-0000-4000-8000-000000000000",
        "kind": "color",
        "name": "Background"
      }
    ]
  },
  "projectId": "06000000-0000-4000-8000-000000000000",
  "schemaVersion": 1
}
